{
  "allowed_use": "pipeline_dry_run_only",
  "confidence_notes": "synthetic_sample_no_real_audio_no_external_source_no_evidence_use",
  "created_at_utc": "2026-05-20T16:56:59Z",
  "date": "2026-05-20",
  "download_operator_approval": false,
  "download_performed": false,
  "duration": "00:00:55",
  "evidence_use_allowed": "no",
  "known_transcription_gaps": [],
  "language": "en",
  "not_real_source": true,
  "not_usable_as_evidence": true,
  "operator_approval": true,
  "public_output_allowed": false,
  "report_use_allowed": false,
  "requires_human_review": true,
  "rights_status": "synthetic_internal_test_only",
  "sample_type": "synthetic_operator_test",
  "schema_version": "media_ingest_metadata_v1",
  "source_owner": "Operator-approved synthetic test fixture",
  "source_path": "outputs/media_ingest/sample_packet_001/transcript_raw.txt",
  "source_title": "Synthetic Media Ingest Test",
  "source_type": "synthetic_test",
  "source_url": "not_applicable_synthetic_test",
  "transcription_method": "synthetic_manual_test"
}
